{
  "schema_version": 1,
  "fixture_id": "kilo-7.5.0-portable-rich",
  "format": "kilo",
  "case": "portable-rich",
  "native_session_id": "ses_fa5d744f8ffe79PUm4HOpPE6VE",
  "native_title": "repair-event-window-boundary",
  "native_cwd": "/fixture/work",
  "producer": {
    "name": "Kilo Code CLI",
    "version": "7.5.0",
    "package_or_tag": "@kilocode/cli@7.5.0",
    "source_commit": null,
    "platform": "linux-x86_64",
    "binary_sha256": "ede061eb9178d0158ac66baa81619e2bf66859041d20d0a014798d38ddc7c1ce",
    "binary_size": 145118408
  },
  "capture": {
    "created_by_exact_cli": true,
    "capture_kind": "actual_cli_trajectory",
    "scenario_version": 1,
    "provider_kind": "loopback",
    "model_alias": "fixture/fixture-model",
    "captured_at": "2026-08-31T23:30:13.895Z",
    "raw_private_sha256": "70fd92295e24ff9cde5689005003fa6e6365c4fe1a6c91f0b8117a3d4afd9144"
  },
  "artifacts": [
    {
      "path": "native/export.json",
      "media_type": "application/json",
      "size": 89876,
      "sha256": "2c0d9e37c0859eaf479cb2fd6efd3d166f68a8979b68b96590de08fad7026104",
      "mode": "0600",
      "role": "transcript"
    }
  ],
  "modalities": {
    "text": {
      "attempted": true,
      "native_accepted": true,
      "fixture_present": true,
      "portable": "preserve"
    },
    "tool_call": {
      "attempted": true,
      "native_accepted": true,
      "fixture_present": true,
      "portable": "preserve"
    },
    "tool_result": {
      "attempted": true,
      "native_accepted": true,
      "fixture_present": true,
      "portable": "preserve"
    },
    "user_image": {
      "attempted": true,
      "native_accepted": true,
      "fixture_present": true,
      "portable": "preserve"
    },
    "document": {
      "attempted": true,
      "native_accepted": true,
      "fixture_present": true,
      "portable": "lossy"
    },
    "audio": {
      "attempted": true,
      "native_accepted": false,
      "fixture_present": false,
      "portable": "unsupported"
    },
    "video": {
      "attempted": true,
      "native_accepted": false,
      "fixture_present": false,
      "portable": "unsupported"
    },
    "tool_result_image": {
      "attempted": false,
      "native_accepted": false,
      "fixture_present": false,
      "portable": "preserve"
    },
    "compaction": {
      "attempted": false,
      "native_accepted": false,
      "fixture_present": false,
      "portable": "preserve"
    },
    "readable_reasoning": {
      "attempted": false,
      "native_accepted": false,
      "fixture_present": false,
      "portable": "preserve"
    }
  },
  "observations": {
    "document": "The public run --file surface accepted the PDF as a native file part. The source parser preserves its existence as opaque reason opencode_nonportable_file because the portable IR has no user-document event.",
    "audio": "The public run --file surface rejected WAV with 'Cannot read binary file' before provider submission. The official export contains the native synthetic rejection text and no audio file part.",
    "video": "The public run --file surface rejected MP4 with 'Cannot read binary file' before provider submission. The official export contains the native synthetic rejection text and no video file part."
  },
  "sanitization": {
    "required": true,
    "sanitizer": "scripts/native-corpus/sanitize-opencode-kilo.py",
    "sanitizer_git_sha": "34da962ba6f0e7e63e69c4616b535c89b37ca312",
    "mutations": [
      {
        "selector": "message metadata path",
        "category": "path",
        "count": 6
      },
      {
        "selector": "message part path",
        "category": "path",
        "count": 18
      },
      {
        "selector": "session directory",
        "category": "path",
        "count": 1
      },
      {
        "selector": "session path",
        "category": "path",
        "count": 1
      }
    ],
    "secret_scan": "pass",
    "content_review": "pass",
    "sanitized_artifact_set_sha256": "c332017fe4d87a903e96755a6e591e49dbac4d01db64671f7928069fbcbded40",
    "reloaded_by_exact_cli": true,
    "reloaded_version": "7.5.0",
    "reloaded_binary_sha256": "ede061eb9178d0158ac66baa81619e2bf66859041d20d0a014798d38ddc7c1ce"
  },
  "expectations": {
    "ir": "expected-ir.jsonl",
    "ir_sha256": "c152304fae1e552c72fa14f26aa20d34da7525d97a2af18c597f66d87aa00eec",
    "event_counts": {
      "context": 1,
      "message": 16,
      "opaque": 26,
      "tool_call": 3,
      "tool_result": 3
    },
    "opaque_loss_reasons": {
      "opencode_nonportable_file": 1,
      "opencode_session_permission": 1,
      "opencode_session_summary": 1,
      "opencode_step-finish_part": 6,
      "opencode_step-start_part": 6,
      "opencode_tool_metadata": 3,
      "opencode_user_summary_metadata": 4,
      "opencode_user_tool_policy": 4
    }
  }
}
